{
  "name": "GetOrder",
  "module": "Ordering",
  "actor": "Customer",
  "input": [{ "name": "orderId", "type": "string" }],
  "result": [{ "name": "status", "type": "string" }, { "name": "lineCount", "type": "number" }],
  "steps": [
    { "text": "读取订单", "call": { "kind": "repository", "target": "OrderRepository", "method": "findById" }, "output": "order" }
  ],
  "traces": ["G-002"],
  "questions": []
}
